{
  "schema_version": 1,
  "reference_commit": "4c6b3e8f5835b228723caea3c9f683c62f244f73",
  "intake": [
    {
      "id": "intake.original-pin",
      "state": "resolved",
      "requirement": "Original commit/tree fetched directly from riperiperi/FreeSO and every original blob compared. All 5,465 source/asset blobs match; only declared .gitignore metadata differs. Two pinned gitlinks remain part of unresolved registration/submodule closure, not gameplay qualification."
    },
    {
      "id": "intake.registration-closure",
      "state": "unresolved",
      "requirement": "Expand active screens, primitives, network commands, packet maps, handlers, data providers, database/tasks, creator editors, SDK-default compilation, non-solution projects and submodule dispositions. The 71 seeded capability rows are not the entire game census."
    }
  ],
  "capabilities": [
    {
      "id": "source.3d-mesh-pipeline",
      "source_pin": "4c6b3e8f5835b228723caea3c9f683c62f244f73",
      "source_paths": [
        "TSOClient/tso.content/RCMeshProvider.cs",
        "TSOClient/tso.files/RC/DGRP3DMesh.cs"
      ],
      "source_sha256": {
        "TSOClient/tso.content/RCMeshProvider.cs": "40287c60b6ee6c5c5463a2997af223c56c0283888a5b30cea7dcfc9adaaa7bc1",
        "TSOClient/tso.files/RC/DGRP3DMesh.cs": "e15a9b3d11d014852abe5bdca9ef60e1a65564b669bbd7c7cbfa4de76cf267dd"
      },
      "upstream_status": "requires_behavior_inspection",
      "product_behavior": "Sprite/depth reconstruction, embedded FSOM, replacement meshes/textures, cache precedence and invalidation",
      "rust_paths": [],
      "provider": "requires_authoritative_provider_reconciliation",
      "dependencies": [
        "intake.original-pin",
        "intake.registration-closure"
      ],
      "journey": "Load an original object family in 3D, verify replacement precedence and reconstructed fallback, rotate and pick it after cache reload.",
      "evidence": [],
      "status": "unassessed"
    },
    {
      "id": "source.graphics-camera-modes",
      "source_pin": "4c6b3e8f5835b228723caea3c9f683c62f244f73",
      "source_paths": [
        "TSOClient/tso.world/GraphicsModeControl.cs",
        "TSOClient/tso.world/Model/GraphicsModes.cs",
        "TSOClient/tso.world/Utils/Camera/CameraControllers.cs"
      ],
      "source_sha256": {
        "TSOClient/tso.world/GraphicsModeControl.cs": "0b9417311f24f8f81e65ae1a22241d25e41bdb4e1c30d16145e25e98d4c2f861",
        "TSOClient/tso.world/Model/GraphicsModes.cs": "8f9acf76079ba7a24630fbbf96312f95af122b6e482e5c2ffcc102951b90a912",
        "TSOClient/tso.world/Utils/Camera/CameraControllers.cs": "75aba63dde9d3601d524e4885d9ec427ad15e89b10125c5fc3095e878e5a4ebf"
      },
      "upstream_status": "requires_behavior_inspection",
      "product_behavior": "Full2D, Hybrid2D, Full3D and perspective/first-person camera transitions",
      "rust_paths": [],
      "provider": "requires_authoritative_provider_reconciliation",
      "dependencies": [
        "intake.original-pin",
        "intake.registration-closure"
      ],
      "journey": "Switch supported modes while interacting, preserving camera/picks and actual world state.",
      "evidence": [],
      "status": "unassessed"
    },
    {
      "id": "source.city-lot-continuity",
      "source_pin": "4c6b3e8f5835b228723caea3c9f683c62f244f73",
      "source_paths": [
        "TSOClient/tso.client/Rendering/City/CityFoliage.cs",
        "TSOClient/tso.client/Rendering/City/CityNeighGeom.cs",
        "TSOClient/tso.world/Components/SubWorldComponent.cs",
        "TSOClient/tso.world/Facade/LotFacadeGenerator.cs"
      ],
      "source_sha256": {
        "TSOClient/tso.client/Rendering/City/CityFoliage.cs": "273cc03ecb6ec0042e22f45003b4e2ad1e601cfcb2e0dc59a793fa107e316c7e",
        "TSOClient/tso.client/Rendering/City/CityNeighGeom.cs": "1ea6125cf4d71fd07b235ebcbd08c406b9151229c5ce986c8e05783898d399fa",
        "TSOClient/tso.world/Components/SubWorldComponent.cs": "27588581d28ac5e9973365878df450ae36f064216e4031a39102f040d01c732b",
        "TSOClient/tso.world/Facade/LotFacadeGenerator.cs": "e84d59b4795cb9a939628fc4c945ebf785e0d9f78459178bf00cbc903c3cd58e"
      },
      "upstream_status": "requires_behavior_inspection",
      "product_behavior": "Neighboring subworlds/facades, city roads/foliage, neighborhood geometry and thumbnails",
      "rust_paths": [],
      "provider": "requires_authoritative_provider_reconciliation",
      "dependencies": [
        "intake.original-pin",
        "intake.registration-closure"
      ],
      "journey": "Discover, inspect and enter a property with correct facade/thumbnail/neighbors; edit and reverify its representation.",
      "evidence": [],
      "status": "unassessed"
    },
    {
      "id": "source.environment-rendering",
      "source_pin": "4c6b3e8f5835b228723caea3c9f683c62f244f73",
      "source_paths": [
        "TSOClient/tso.world/LMap/GPURoomMaps.cs",
        "TSOClient/tso.world/LMap/LMapBatch.cs",
        "TSOClient/tso.world/LMap/ShadowGeometry.cs",
        "TSOClient/tso.world/Model/WeatherController.cs"
      ],
      "source_sha256": {
        "TSOClient/tso.world/LMap/GPURoomMaps.cs": "917a786d5b13e15719b1a38d63ea6eb3baa93caf286199c7d41f970d84dd70e2",
        "TSOClient/tso.world/LMap/LMapBatch.cs": "b5b29bac9dea5a77b66e5bc20620a2dd0e1db16195c7c68e611e5ff8c999e424",
        "TSOClient/tso.world/LMap/ShadowGeometry.cs": "b7ca53666307c10a676a3bbaf7c2fa7422dc022243902d4f7f633b7e4e9a0d40",
        "TSOClient/tso.world/Model/WeatherController.cs": "ea18edc262102d3a17178e916e9ab853a910915b811ece52d22ff30f52c51890"
      },
      "upstream_status": "requires_behavior_inspection",
      "product_behavior": "Room lighting/shadows, sky, particles and source-driven weather",
      "rust_paths": [],
      "provider": "requires_authoritative_provider_reconciliation",
      "dependencies": [
        "intake.original-pin",
        "intake.registration-closure"
      ],
      "journey": "Change room structure and time/weather inputs; inspect lighting, particles, visibility and context recovery.",
      "evidence": [],
      "status": "unassessed"
    },
    {
      "id": "source.job-worlds",
      "source_pin": "4c6b3e8f5835b228723caea3c9f683c62f244f73",
      "source_paths": [
        "TSOClient/FSO.Server/Servers/City/Domain/JobMatchmaker.cs",
        "TSOClient/tso.simantics/Model/TSOPlatform/VMTSOJobInfo.cs",
        "TSOClient/tso.simantics/Primitives/VMOnlineJobsCall.cs"
      ],
      "source_sha256": {
        "TSOClient/FSO.Server/Servers/City/Domain/JobMatchmaker.cs": "50c677c2fa7a0f51e8d8c4bc56d80703777188a4773add9de2498b449c7ef355",
        "TSOClient/tso.simantics/Model/TSOPlatform/VMTSOJobInfo.cs": "cf5f2bcbf19212736d83d367a1537122876b81cb0266bc03a126bc82a40e6f96",
        "TSOClient/tso.simantics/Primitives/VMOnlineJobsCall.cs": "38f04c38a5478cfe32d48bf3164c6181c47bf099d5eb4d56a44135ce89f3547a"
      },
      "upstream_status": "requires_behavior_inspection",
      "product_behavior": "Instanced career/grade/role-matched robot-factory, restaurant and nightclub shifts",
      "rust_paths": [],
      "provider": "requires_authoritative_provider_reconciliation",
      "dependencies": [
        "intake.original-pin",
        "intake.registration-closure"
      ],
      "journey": "Match eligible players, respect ignore lists/roles, complete rounds, persist progression and return after disconnect.",
      "evidence": [],
      "status": "unassessed"
    },
    {
      "id": "source.earning-dynamic-payouts",
      "source_pin": "4c6b3e8f5835b228723caea3c9f683c62f244f73",
      "source_paths": [
        "TSOClient/FSO.Server/Servers/Tasks/Domain/JobBalanceTask.cs",
        "TSOClient/tso.simantics/NetPlay/EODs/Handlers/VMEODFNewspaperPlugin.cs"
      ],
      "source_sha256": {
        "TSOClient/FSO.Server/Servers/Tasks/Domain/JobBalanceTask.cs": "556cbb1838e0860f59122bd8977af39fd8bbd652167e765773b74c88946ec024",
        "TSOClient/tso.simantics/NetPlay/EODs/Handlers/VMEODFNewspaperPlugin.cs": "84da0dd6b542f01be3f1fc7c5ecb7e8822b3139625e9801c7294e9e7474477f4"
      },
      "upstream_status": "requires_behavior_inspection",
      "product_behavior": "Single-object earning cohorts, economic history and dynamic payout tuning",
      "rust_paths": [],
      "provider": "requires_authoritative_provider_reconciliation",
      "dependencies": [
        "intake.original-pin",
        "intake.registration-closure"
      ],
      "journey": "Earn via supported object chains, apply an idempotent tuning period and verify authority-derived newspaper/economic projection.",
      "evidence": [],
      "status": "unassessed"
    },
    {
      "id": "source.visitor-bonuses-rankings",
      "source_pin": "4c6b3e8f5835b228723caea3c9f683c62f244f73",
      "source_paths": [
        "TSOClient/FSO.Server/Servers/Tasks/Domain/BonusTask.cs"
      ],
      "source_sha256": {
        "TSOClient/FSO.Server/Servers/Tasks/Domain/BonusTask.cs": "dd83dae458ecf0f1ca601c00eb325f659d05efd00278ac57582f2a9b21c6252b"
      },
      "upstream_status": "requires_behavior_inspection",
      "product_behavior": "Durable visits, Top 100 and category-scaled visitor/property bonuses",
      "rust_paths": [],
      "provider": "requires_authoritative_provider_reconciliation",
      "dependencies": [
        "intake.original-pin",
        "intake.registration-closure"
      ],
      "journey": "Visit across a period boundary, calculate once, rerun after failure and verify ranking and bonus without double payment.",
      "evidence": [],
      "status": "unassessed"
    },
    {
      "id": "source.player-shops",
      "source_pin": "4c6b3e8f5835b228723caea3c9f683c62f244f73",
      "source_paths": [
        "TSOClient/FSO.Server/Servers/Lot/Domain/LotServerGlobalLink.cs",
        "TSOClient/tso.simantics/Model/VMBuildableAreaInfo.cs",
        "TSOClient/tso.simantics/NetPlay/EODs/Handlers/VMEODRackOwnerPlugin.cs",